{
  "tournament": "FIFA World Cup 2026",
  "generated_at": "2026-06-15T07:02:00-05:00",
  "timezone": "America/Chicago",
  "matches": [
    { "id": "A-MD2-1", "group": "A", "matchday": 2, "kickoff": "2026-06-19T17:00:00-05:00", "status": "played", "home": "MEX", "away": "CAN", "prob": { "win": 48, "draw": 30, "loss": 22 }, "verdict": "home_win", "rationale": "멕시코의 풀백 오버랩이 캐나다 압박 라인 측면을 공략.", "team_notes": { "home": "측면 과부하", "away": "전방 압박" }, "key_variables": ["경기 종료"], "flip_condition": "—", "qualification_context": "종료된 경기", "sources": [] },
    { "id": "A-MD3-1", "group": "A", "matchday": 3, "kickoff": "2026-06-24T17:00:00-05:00", "status": "upcoming", "home": "MEX", "away": "POL", "prob": { "win": 56, "draw": 24, "loss": 20 }, "verdict": "home_win", "rationale": "멕시코의 측면 과부하가 폴란드 윙백 뒤 공간을 반복적으로 겨냥. 폴란드는 낮은 블록 후 역습 의존.", "team_notes": { "home": "빠른 전환 / 풀백 오버랩", "away": "수비 블록 / 세트피스" }, "key_variables": ["폴란드 주전 CB 의심", "멕시코 무승부면 진출 유력"], "flip_condition": "폴란드 선제골 후 블록을 낮추면 무승부 비중 상승", "qualification_context": "멕시코는 패하지 않으면 진출 유력, 폴란드는 승리 필요", "sources": ["https://example.com/a"] },
    { "id": "A-MD3-2", "group": "A", "matchday": 3, "kickoff": "2026-06-24T20:00:00-05:00", "status": "upcoming", "home": "CAN", "away": "RSA", "prob": { "win": 39, "draw": 31, "loss": 30 }, "verdict": "home_win", "rationale": "캐나다 전방 압박과 남아공 전환이 같은 공간에서 충돌. 후반 변동성 큼.", "team_notes": { "home": "전방 압박 / 하프스페이스", "away": "빠른 역습 / 롱 전환" }, "key_variables": ["양 팀 체력", "후반 교체 타이밍"], "flip_condition": "남아공이 전반 압박을 견디면 원정 승 확률 상승", "qualification_context": "승리 팀이 3위권 경쟁에서 유리", "sources": [] },
    { "id": "B-MD3-1", "group": "B", "matchday": 3, "kickoff": "2026-06-25T14:00:00-05:00", "status": "upcoming", "home": "USA", "away": "SRB", "prob": { "win": 61, "draw": 22, "loss": 17 }, "verdict": "home_win", "rationale": "미국의 압박과 2선 침투가 세르비아 빌드업 첫 패스를 흔든다. 오픈 플레이 회복 속도 우세.", "team_notes": { "home": "재압박 / 2선 침투", "away": "제공권 / 세트피스" }, "key_variables": ["미국 홈 이점", "세르비아 세트피스"], "flip_condition": "세르비아가 세트피스 선제골을 넣는 경우", "qualification_context": "미국 승리 시 조 1위 유력", "sources": [] },
    { "id": "B-MD3-2", "group": "B", "matchday": 3, "kickoff": "2026-06-25T17:00:00-05:00", "status": "upcoming", "home": "JPN", "away": "CRO", "prob": { "win": 34, "draw": 29, "loss": 37 }, "verdict": "away_win", "rationale": "일본 측면 전환은 위협적이나 크로아티아가 중원 템포를 늦추면 리듬이 원정팀으로. 확률 차가 작음.", "team_notes": { "home": "하프스페이스 침투", "away": "중원 점유 / 템포 조절" }, "key_variables": ["중원 점유율", "선발 명단 확인"], "flip_condition": "일본이 초반 측면 스프린트로 선제골을 만드는 경우", "qualification_context": "승자 진출 유력, 무승부 시 득실 경쟁", "sources": [] }
  ]
}
